{
  "$schema": "https://json-schema.org/draft/2020-12/schema",
  "$id": "https://github.com/rknightion/grafana-cloud-org-insights/consumer/manifest.schema.json",
  "title": "Grafana Cloud Org Insights deployment manifest",
  "type": "object",
  "additionalProperties": false,
  "required": [
    "schema_version",
    "generic_source",
    "overlay_digest",
    "runtime_projection_digests",
    "runtime",
    "aws",
    "policy"
  ],
  "properties": {
    "schema_version": {"const": 1},
    "generic_source": {
      "type": "object",
      "additionalProperties": false,
      "required": ["repository", "revision"],
      "properties": {
        "repository": {"type": "string", "minLength": 1},
        "revision": {"type": "string", "pattern": "^[0-9a-f]{40}$"}
      }
    },
    "overlay_digest": {"type": "string", "pattern": "^[0-9a-f]{64}$"},
    "runtime_projection_digests": {
      "type": "object",
      "additionalProperties": false,
      "required": ["scan", "provisioner", "dashboards", "alerts"],
      "properties": {
        "scan": {"$ref": "#/$defs/digest"},
        "provisioner": {"$ref": "#/$defs/digest"},
        "dashboards": {"$ref": "#/$defs/digest"},
        "alerts": {"$ref": "#/$defs/digest"}
      }
    },
    "runtime": {
      "type": "object",
      "additionalProperties": false,
      "$comment": "Each projection holds exactly collector.identity.PROJECTION_ENVS once omitted keys are filled. The independent scan GCINSIGHT_OUTCOME_OBSERVER_ENABLED flag is additive default-off: omission retains old digests, enabled requires regenerated digests. Only scan and provisioner keys the module renders from a variable default may be omitted; dashboards and alerts are always complete.",
      "required": ["scan", "provisioner", "dashboards", "alerts"],
      "properties": {
        "scan": {"$ref": "#/$defs/stringMap"},
        "provisioner": {"$ref": "#/$defs/stringMap"},
        "dashboards": {"$ref": "#/$defs/stringMap"},
        "alerts": {"$ref": "#/$defs/stringMap"}
      }
    },
    "aws": {
      "type": "object",
      "additionalProperties": false,
      "$comment": "Every property is part of the effective manifest. One whose value is the module default may be omitted (bin/consumer_manifest.py regenerate --prune-defaults); bin/consumer_manifest.py fills it from the pinned module's terraform/ before validating or digesting. An adopted bucket or secret keeps its explicit name.",
      "required": ["name_prefix", "cost_namespace", "purpose_tag"],
      "allOf": [
        {
          "if": {"required": ["create_bucket"], "properties": {"create_bucket": {"const": false}}},
          "then": {"required": ["bucket_name"]}
        },
        {
          "if": {"required": ["create_secret"], "properties": {"create_secret": {"const": false}}},
          "then": {"required": ["secret_name"]}
        }
      ],
      "properties": {
        "name_prefix": {"type": "string"},
        "bucket_name": {"type": "string"},
        "secret_name": {"type": "string"},
        "reader_secret_key": {"type": "string"},
        "writer_secret_key": {"type": "string"},
        "provisioner_secret_key": {"type": "string"},
        "create_bucket": {"type": "boolean"},
        "create_secret": {"type": "boolean"},
        "create_views_reader_user": {"type": "boolean"},
        "create_provisioner": {"type": "boolean"},
        "container_insights_enabled": {"type": "boolean"},
        "firehose_logs_enabled": {"type": "boolean"},
        "firehose_log_subscription_enabled": {"type": "boolean"},
        "assign_public_ip": {"type": "boolean"},
        "schedules_enabled": {"type": "boolean"},
        "provisioner_enabled": {"type": "boolean"},
        "schedule_timezone": {"type": "string"},
        "t1_schedule": {"type": "string"},
        "t2_schedule": {"type": "string"},
        "t3_schedule": {"type": "string"},
        "t4_schedule": {"type": "string"},
        "provisioner_schedule": {"type": "string"},
        "task_architecture": {"enum": ["ARM64", "X86_64"]},
        "manage_adopted_bucket_config": {
          "type": "boolean",
          "$comment": "Optional; absent means false. With create_bucket false, the module manages the adopted bucket's configuration (never the bucket). Read terraform/README.md before setting it."
        },
        "cost_namespace": {"type": "string"},
        "purpose_tag": {"type": "string"}
      }
    },
    "policy": {
      "type": "object",
      "additionalProperties": false,
      "required": [
        "reader_policy_id", "writer_policy_id", "reader_policy_name", "writer_policy_name",
        "provisioner_policy_name", "declared_reader_permission_pairs",
        "datasource_query_scope", "rate_card_present", "rate_card_s3_key",
        "rate_card_semantics", "public_dashboards_target", "pii_storage"
      ],
      "properties": {
        "reader_policy_id": {"type": "string"},
        "writer_policy_id": {"type": "string"},
        "reader_policy_name": {"type": "string"},
        "writer_policy_name": {"type": "string"},
        "provisioner_policy_name": {"type": "string"},
        "declared_reader_permission_pairs": {"type": "integer", "minimum": 0},
        "datasource_query_scope": {"const": "datasources:uid:grafanacloud-usage-insights"},
        "rate_card_present": {"type": "boolean"},
        "rate_card_s3_key": {"type": "string"},
        "rate_card_semantics": {"enum": ["base_rate_only", "dpm_aware"]},
        "public_dashboards_target": {"type": "integer", "minimum": 0},
        "pii_storage": {"type": "string", "minLength": 1}
      }
    }
  },
  "$defs": {
    "digest": {"type": "string", "pattern": "^[0-9a-f]{64}$"},
    "stringMap": {
      "type": "object",
      "propertyNames": {"pattern": "^GCINSIGHT_[A-Z0-9_]+$"},
      "additionalProperties": {"type": "string"}
    }
  }
}
