{
  "aws": {
    "assign_public_ip": false,
    "bucket_name": "synthetic-insights-data",
    "cost_namespace": "synthetic-insights",
    "create_bucket": true,
    "create_provisioner": true,
    "create_secret": false,
    "create_views_reader_user": false,
    "firehose_log_subscription_enabled": false,
    "firehose_logs_enabled": false,
    "name_prefix": "synthetic-insights",
    "provisioner_enabled": true,
    "provisioner_schedule": "cron(15 3 * * ? *)",
    "provisioner_secret_key": "GCINSIGHT_PROVISION_TOKEN",
    "purpose_tag": "estate-insights",
    "reader_secret_key": "GCINSIGHT_READ_TOKEN",
    "schedule_timezone": "UTC",
    "schedules_enabled": true,
    "secret_name": "synthetic-insights/tokens",
    "t1_schedule": "cron(5 * * * ? *)",
    "t2_schedule": "cron(20 3 * * ? *)",
    "t3_schedule": "cron(40 2,8,14,20 * * ? *)",
    "t4_schedule": "cron(0 9 * * ? *)",
    "task_architecture": "X86_64",
    "writer_secret_key": "SYNTHETIC_WRITE_TOKEN"
  },
  "generic_source": {
    "repository": "https://github.com/rknightion/grafana-cloud-org-insights.git",
    "revision": "0000000000000000000000000000000000000000"
  },
  "overlay_digest": "344338e90a84949c9a66d6502ae35ca3c4d35a56bafa3cb906594b71838de988",
  "policy": {
    "datasource_query_scope": "datasources:uid:grafanacloud-usage-insights",
    "declared_reader_permission_pairs": 36,
    "pii_storage": "cleartext-internal",
    "provisioner_policy_name": "synthetic-provisioner",
    "public_dashboards_target": 0,
    "rate_card_present": false,
    "rate_card_s3_key": "config/ratecard.csv",
    "rate_card_semantics": "base_rate_only",
    "reader_policy_id": "synthetic-reader-id",
    "reader_policy_name": "synthetic-reader",
    "writer_policy_id": "synthetic-writer-id",
    "writer_policy_name": "synthetic-writer"
  },
  "runtime": {
    "alerts": {
      "GCINSIGHT_ALERT_RULE_GROUP": "synthetic-4",
      "GCINSIGHT_ALERT_RULE_UIDS_JSON": "{}",
      "GCINSIGHT_ALERT_SERVICE_LABEL": "synthetic-8",
      "GCINSIGHT_ALERT_TITLE_PREFIX": "synthetic-6",
      "GCINSIGHT_ALERT_TITLE_SEPARATOR": "synthetic-7",
      "GCINSIGHT_INSIGHTS_FOLDER_UID": "synthetic-1",
      "GCINSIGHT_METRIC_PREFIX": "synthetic-3",
      "GCINSIGHT_PROM_DS_UID": "synthetic-2",
      "GCINSIGHT_WRITE_STACK_URL": "synthetic-0"
    },
    "dashboards": {
      "GCINSIGHT_DASHBOARD_DS_NAME": "synthetic-7",
      "GCINSIGHT_DASHBOARD_FOLDER_TITLE": "synthetic-8",
      "GCINSIGHT_DASHBOARD_TAG": "synthetic-9",
      "GCINSIGHT_DASHBOARD_TITLE_PREFIX": "synthetic-6",
      "GCINSIGHT_DASHBOARD_UID_PREFIX": "synthetic-5",
      "GCINSIGHT_INSIGHTS_FOLDER_UID": "synthetic-10",
      "GCINSIGHT_METRIC_PREFIX": "synthetic-4",
      "GCINSIGHT_S3_BUCKET": "synthetic-2",
      "GCINSIGHT_S3_REGION": "synthetic-3",
      "GCINSIGHT_WRITE_STACK_ID": "synthetic-0",
      "GCINSIGHT_WRITE_STACK_URL": "synthetic-1"
    },
    "provisioner": {
      "GCINSIGHT_ADMIN_SA_NAME": "gcinsight-insights-provisioner",
      "GCINSIGHT_OPT_OUT": "synthetic-skip-a,synthetic-skip-b",
      "GCINSIGHT_ORG_ID": "100001",
      "GCINSIGHT_READER_PRODUCT_READS": "slo,synthetic-monitoring",
      "GCINSIGHT_READER_SA_NAME": "gcinsight-data",
      "GCINSIGHT_ROLE_DISPLAY": "Grafana Cloud Org Insights reader",
      "GCINSIGHT_ROLE_GROUP": "Synthetic Insights",
      "GCINSIGHT_ROLE_NAME": "custom:gcinsight.reader",
      "GCINSIGHT_SSM_REGION": "us-east-1",
      "GCINSIGHT_STACK_TOKEN_PREFIX": "/gcinsight/stack-token",
      "GCINSIGHT_TOKEN_NAME_PREFIX": "synthetic-data"
    },
    "scan": {
      "GCINSIGHT_COVERAGE_SCORE_WEIGHTS": "{\"metrics\": 2, \"logs\": 1, \"traces\": 1, \"profiles\": 0.5, \"dashboard\": 1, \"alert\": 1, \"slo\": 1}",
      "GCINSIGHT_DASHBOARD_DETAIL_ENABLED": "0",
      "GCINSIGHT_EXPECTED_RETENTION_POLICY": "[]",
      "GCINSIGHT_FLEET_DEFAULT_SCRAPE_INTERVAL": "60s",
      "GCINSIGHT_LABEL_INVENTORY_BUDGET_SECONDS": "900",
      "GCINSIGHT_LABEL_INVENTORY_ENABLED": "1",
      "GCINSIGHT_LABEL_INVENTORY_STATIC_NAMES": "[\"cluster\",\"host\",\"hostname\",\"k8s.cluster.name\",\"k8s.namespace.name\",\"k8s.node.name\",\"k8s_cluster_name\",\"k8s_namespace_name\",\"k8s_node_name\",\"namespace\",\"node\"]",
      "GCINSIGHT_LABEL_INVENTORY_TUNABLES": "{}",
      "GCINSIGHT_LOKI_JOB": "gcinsight",
      "GCINSIGHT_LOKI_TENANT": "300003",
      "GCINSIGHT_LOKI_URL": "https://logs.example.invalid",
      "GCINSIGHT_METRIC_PREFIX": "gcinsight",
      "GCINSIGHT_MIMIR_TENANT": "200002",
      "GCINSIGHT_MIMIR_URL": "https://metrics.example.invalid",
      "GCINSIGHT_OPT_OUT": "synthetic-skip-a,synthetic-skip-b",
      "GCINSIGHT_ORG_ID": "100001",
      "GCINSIGHT_READER_PRODUCT_READS": "slo,synthetic-monitoring",
      "GCINSIGHT_S3_BUCKET": "synthetic-insights-data",
      "GCINSIGHT_S3_REGION": "us-east-1",
      "GCINSIGHT_SSM_REGION": "us-east-1",
      "GCINSIGHT_STACK_TOKEN_PREFIX": "/gcinsight/stack-token",
      "GCINSIGHT_USER_AGENT": "gcinsight-collector/1 (+grafana-ps)",
      "GCINSIGHT_WRITE_STACK": "synthetic-write"
    }
  },
  "runtime_projection_digests": {
    "alerts": "bc9560b126d38d07df6b3d7ef3826a263b86147542ef671edb18b7705f635e2c",
    "dashboards": "4f2ebf4bf0828aae10940d8b8c8df937f0687dabae64f6d9e47e8cd2d25cbd3b",
    "provisioner": "40cf27394b324190aef5d74956f851b09bfe8d880d91f9893ad2855f042621ab",
    "scan": "1c2c21297e342f6de27756dea4f0d629fc2cadfb6836508b0c087c3ae6977857"
  },
  "schema_version": 1
}
