{
  "aws": {
    "assign_public_ip": true,
    "bucket_name": "synthetic-adopted-bucket",
    "cost_namespace": "synthetic-cost-namespace",
    "create_bucket": false,
    "create_provisioner": true,
    "create_secret": false,
    "create_views_reader_user": false,
    "firehose_log_subscription_enabled": true,
    "firehose_logs_enabled": true,
    "manage_adopted_bucket_config": true,
    "name_prefix": "synthetic-distinct",
    "provisioner_enabled": false,
    "provisioner_schedule": "cron(45 2 * * ? *)",
    "provisioner_secret_key": "SYNTHETIC_PROVISION",
    "purpose_tag": "synthetic-purpose",
    "reader_secret_key": "SYNTHETIC_READ",
    "schedule_timezone": "Europe/London",
    "schedules_enabled": true,
    "secret_name": "synthetic/adopted-secret",
    "t1_schedule": "cron(7 * * * ? *)",
    "t2_schedule": "cron(10 4 * * ? *)",
    "t3_schedule": "cron(50 1,7,13,19 * * ? *)",
    "t4_schedule": "cron(30 10 * * ? *)",
    "task_architecture": "X86_64",
    "writer_secret_key": "SYNTHETIC_WRITE"
  },
  "generic_source": {
    "repository": "https://github.com/rknightion/grafana-cloud-org-insights.git",
    "revision": "0000000000000000000000000000000000000000"
  },
  "overlay_digest": "2c7e7ff42d1002520f1559a7b976f83cab7459d25149fe032eff44b9070f39ed",
  "policy": {
    "datasource_query_scope": "datasources:uid:grafanacloud-usage-insights",
    "declared_reader_permission_pairs": 36,
    "pii_storage": "cleartext-internal",
    "provisioner_policy_name": "synthetic-provisioner",
    "public_dashboards_target": 0,
    "rate_card_present": false,
    "rate_card_s3_key": "config/ratecard.csv",
    "rate_card_semantics": "base_rate_only",
    "reader_policy_id": "synthetic-reader-id",
    "reader_policy_name": "synthetic-reader",
    "writer_policy_id": "synthetic-writer-id",
    "writer_policy_name": "synthetic-writer"
  },
  "runtime": {
    "alerts": {
      "GCINSIGHT_ALERT_RULE_GROUP": "synthetic-4",
      "GCINSIGHT_ALERT_RULE_UIDS_JSON": "{}",
      "GCINSIGHT_ALERT_SERVICE_LABEL": "synthetic-8",
      "GCINSIGHT_ALERT_TITLE_PREFIX": "synthetic-6",
      "GCINSIGHT_ALERT_TITLE_SEPARATOR": "synthetic-7",
      "GCINSIGHT_INSIGHTS_FOLDER_UID": "synthetic-1",
      "GCINSIGHT_METRIC_PREFIX": "synthetic-3",
      "GCINSIGHT_PROM_DS_UID": "synthetic-2",
      "GCINSIGHT_WRITE_STACK_URL": "synthetic-0"
    },
    "dashboards": {
      "GCINSIGHT_DASHBOARD_DS_NAME": "synthetic-7",
      "GCINSIGHT_DASHBOARD_FOLDER_TITLE": "synthetic-8",
      "GCINSIGHT_DASHBOARD_TAG": "synthetic-9",
      "GCINSIGHT_DASHBOARD_TITLE_PREFIX": "synthetic-6",
      "GCINSIGHT_DASHBOARD_UID_PREFIX": "synthetic-5",
      "GCINSIGHT_INSIGHTS_FOLDER_UID": "synthetic-10",
      "GCINSIGHT_METRIC_PREFIX": "synthetic-4",
      "GCINSIGHT_S3_BUCKET": "synthetic-2",
      "GCINSIGHT_S3_REGION": "synthetic-3",
      "GCINSIGHT_WRITE_STACK_ID": "synthetic-0",
      "GCINSIGHT_WRITE_STACK_URL": "synthetic-1"
    },
    "provisioner": {
      "GCINSIGHT_ADMIN_SA_NAME": "synthetic-admin-sa",
      "GCINSIGHT_OPT_OUT": "synthetic-skip-c",
      "GCINSIGHT_ORG_ID": "100001",
      "GCINSIGHT_READER_PRODUCT_READS": "reports,playlists",
      "GCINSIGHT_READER_SA_NAME": "synthetic-reader-sa",
      "GCINSIGHT_ROLE_DISPLAY": "Synthetic reader role",
      "GCINSIGHT_ROLE_GROUP": "Synthetic Insights",
      "GCINSIGHT_ROLE_NAME": "custom:synthetic.reader",
      "GCINSIGHT_SSM_REGION": "us-east-1",
      "GCINSIGHT_STACK_TOKEN_PREFIX": "/synthetic/stack-token",
      "GCINSIGHT_TOKEN_NAME_PREFIX": "synthetic-data"
    },
    "scan": {
      "GCINSIGHT_COVERAGE_SCORE_WEIGHTS": "{\"metrics\": 3, \"logs\": 2, \"traces\": 0, \"profiles\": 0.25, \"dashboard\": 1, \"alert\": 4, \"slo\": 5}",
      "GCINSIGHT_DASHBOARD_DETAIL_ENABLED": "1",
      "GCINSIGHT_EXPECTED_RETENTION_POLICY": "[{\"selector\": \"{kind=\\\"audit\\\"}\", \"minimum_period\": \"14d\"}]",
      "GCINSIGHT_FLEET_DEFAULT_SCRAPE_INTERVAL": "30s",
      "GCINSIGHT_LABEL_INVENTORY_BUDGET_SECONDS": "600",
      "GCINSIGHT_LABEL_INVENTORY_ENABLED": "1",
      "GCINSIGHT_LABEL_INVENTORY_STATIC_NAMES": "[\"synthetic_cluster\"]",
      "GCINSIGHT_LABEL_INVENTORY_TUNABLES": "{\"size_floor\": 200}",
      "GCINSIGHT_LOKI_JOB": "synthetic-job",
      "GCINSIGHT_LOKI_TENANT": "300003",
      "GCINSIGHT_LOKI_URL": "https://logs.example.invalid",
      "GCINSIGHT_METRIC_PREFIX": "synthetic_metrics",
      "GCINSIGHT_MIMIR_TENANT": "200002",
      "GCINSIGHT_MIMIR_URL": "https://metrics.example.invalid",
      "GCINSIGHT_OPT_OUT": "synthetic-skip-c",
      "GCINSIGHT_ORG_ID": "100001",
      "GCINSIGHT_READER_PRODUCT_READS": "reports,playlists",
      "GCINSIGHT_S3_BUCKET": "synthetic-adopted-bucket",
      "GCINSIGHT_S3_REGION": "us-east-1",
      "GCINSIGHT_SSM_REGION": "us-east-1",
      "GCINSIGHT_STACK_TOKEN_PREFIX": "/synthetic/stack-token",
      "GCINSIGHT_USER_AGENT": "synthetic-agent/2",
      "GCINSIGHT_WRITE_STACK": "synthetic-write"
    }
  },
  "runtime_projection_digests": {
    "alerts": "bc9560b126d38d07df6b3d7ef3826a263b86147542ef671edb18b7705f635e2c",
    "dashboards": "4f2ebf4bf0828aae10940d8b8c8df937f0687dabae64f6d9e47e8cd2d25cbd3b",
    "provisioner": "2d411105d8e07053389c1e56eefd200f941a4d48ac55a730c3b137c55ce08015",
    "scan": "bc98a27eb13c2e3ccce8a96019206a1e5316bca3edd561624a99c85a06255429"
  },
  "schema_version": 1
}
